{
  "view_version": "1.0.0",
  "inventory_id": "inv_01J9Z00000000000000000M0WR",
  "inventory_hash": "sha256:ecfe12b6a84c6357c0c8049e0e4a581a1b97c1804eed7c8f8990d7e7109a4a4b",
  "audience": "parts_buyer",
  "label": "Parts / Donor",
  "headline": "Brand X 42T riding mower for parts or repair",
  "body": "Known fault: Engine smokes blue under load. Deck and chassis are what they are; check the photos. Hours unknown.",
  "facts": [
    {
      "fact_id": "f1",
      "basis": "seller_stated"
    },
    {
      "fact_id": "f3",
      "basis": "UNKNOWN"
    },
    {
      "fact_id": "f2",
      "basis": "seller_stated"
    }
  ],
  "disclosures": [
    {
      "defect_id": "d1",
      "text": "Engine smokes blue under load"
    }
  ],
  "terms": {
    "price_usd": 400,
    "price_type": "obo",
    "pickup": "Buyer picks up"
  },
  "call_to_action": "Ask about pickup."
}
